{
  "schema_version": "0.1.0",
  "current_project": null,
  "current_phase": "PREFLIGHT",
  "preflight": {
    "status": "NOT_STARTED",
    "mcp_connected": null,
    "authenticated": null,
    "account_hint": null,
    "canvas_access": null,
    "ownership_permission": null,
    "generation_config_checked": null,
    "budget_checked": null,
    "required_capabilities": {
      "canvas_access": "UNVERIFIED",
      "reference_access": "UNVERIFIED",
      "image_generation": "OFFICIAL_DOC",
      "image_to_video": "OFFICIAL_DOC",
      "task_monitoring": "OFFICIAL_DOC",
      "targeted_video_edit": "HACKATHON_OBSERVED",
      "timeline_edit": "HACKATHON_OBSERVED",
      "timeline_export": "HACKATHON_OBSERVED"
    },
    "mcp_version": null,
    "checked_at": null,
    "blocking_reason": null
  },
  "canvas": {
    "id": null,
    "name": null,
    "status": "NOT_STARTED"
  },
  "references": {},
  "style": {
    "status": "NOT_STARTED",
    "remote_id": null,
    "approved": null,
    "locked": null
  },
  "environments": {},
  "scenes": {},
  "current_scene": null,
  "approval_required": "PREFLIGHT_CONFIRMATION",
  "generated_tasks": [],
  "approved_outputs": [],
  "budget": {
    "target_monthly_usd": 60,
    "normal_cap_usd": 100,
    "absolute_ceiling_usd": 150,
    "estimated_project_spend_usd": 0,
    "actual_project_spend_usd": 0,
    "currency": "USD"
  },
  "recovery": {
    "last_failure_level": null,
    "last_failure_reason": null,
    "recommended_action": null
  },
  "resume_hint": "Run a non-chargeable Topview preflight in the active Codex MCP environment before any production operation.",
  "last_updated_at": null
}
